{
  "$schema": "https://json-schema.org/draft/2020-12/schema",
  "$id": "https://project-atlas.dev/schemas/context-pack.schema.json",
  "type": "object",
  "required": ["id", "task_id", "items", "created_at"],
  "properties": {
    "id": { "type": "string", "pattern": "^[A-Za-z0-9._-]+$" },
    "task_id": { "type": "string", "minLength": 1 },
    "items": {
      "type": "array",
      "items": {
        "oneOf": [
          { "type": "string" },
          { "$ref": "context-item.schema.json" }
        ]
      }
    },
    "estimated_tokens": { "type": "integer", "minimum": 0 },
    "actual_tokens": { "type": "integer", "minimum": 0 },
    "created_at": { "type": "string", "minLength": 1 },
    "reason": { "type": "string" }
  },
  "additionalProperties": true
}
